{
  "$schema": "http://json-schema.org/draft-07/schema#",
  "title": "Study Configuration",
  "description": "Configuration schema for an encoding study in web image formats research. A study defines a targeted experiment where specific encoding parameters are swept across a set of source images.",
  "type": "object",
  "required": ["id", "name", "dataset", "encoders"],
  "properties": {
    "$schema": {
      "type": "string",
      "description": "Reference to the JSON schema for IDE validation"
    },
    "id": {
      "type": "string",
      "description": "Unique identifier for the study (used in file paths and CLI)",
      "pattern": "^[a-z0-9][a-z0-9_-]*$"
    },
    "name": {
      "type": "string",
      "description": "Human-readable name of the study"
    },
    "description": {
      "type": "string",
      "description": "Brief description of the study's purpose and what it investigates"
    },
    "time_budget": {
      "type": "number",
      "description": "Maximum wall-clock time in seconds for the pipeline. When set, the pipeline processes as many images as possible within this budget. Can be overridden via CLI.",
      "minimum": 1
    },
    "comparison": {
      "type": "object",
      "description": "Configuration for visual comparison figure generation. Controls which parameter varies within each comparison figure (tiles) and which splits across figures.",
      "properties": {
        "tile_parameter": {
          "type": "string",
          "description": "The encoding parameter that should vary within each comparison figure (i.e. each tile shows a different value of this parameter). All other varying parameters become split axes that produce separate figures. For multi-format studies use 'format'; for speed/effort/method sweeps use the sweep parameter so tiles show all its values at a fixed quality level.",
          "enum": ["format", "quality", "chroma_subsampling", "speed", "effort", "method", "resolution"]
        }
      },
      "additionalProperties": false
    },
    "analysis": {
      "type": "object",
      "description": "Configuration for analysis plot generation. Overrides the automatic parameter detection heuristics.",
      "properties": {
        "x_axis": {
          "type": "string",
          "description": "The parameter to use as the primary x-axis in quality metric and efficiency plots. When omitted, the parameter with the most unique values is used.",
          "enum": ["format", "quality", "chroma_subsampling", "speed", "effort", "method", "resolution"]
        },
        "group_by": {
          "type": "string",
          "description": "The parameter to use for line grouping in plots (each unique value becomes a separate line). When omitted, the parameter with the second-most unique values is used.",
          "enum": ["format", "quality", "chroma_subsampling", "speed", "effort", "method", "resolution"]
        }
      },
      "additionalProperties": false
    },
    "dataset": {
      "type": "object",
      "description": "Source dataset configuration",
      "required": ["id"],
      "properties": {
        "id": {
          "type": "string",
          "description": "Dataset identifier matching an entry in datasets.json"
        },
        "max_images": {
          "type": "integer",
          "description": "Maximum number of images to use from the dataset. Acts as an upper bound even when time_budget is set. If omitted, all images are used.",
          "minimum": 1
        }
      },
      "additionalProperties": false
    },
    "encoders": {
      "type": "array",
      "description": "List of encoder configurations to sweep. Each entry defines one encoder and the parameter space to explore.",
      "minItems": 1,
      "items": {
        "type": "object",
        "required": ["format", "quality"],
        "properties": {
          "format": {
            "type": "string",
            "description": "Image format / encoder to use",
            "enum": ["jpeg", "webp", "avif", "jxl"]
          },
          "quality": {
            "description": "Quality settings to sweep. Can be a single value, an explicit list, or a range definition.",
            "oneOf": [
              {
                "type": "integer",
                "minimum": 0,
                "maximum": 100
              },
              {
                "type": "array",
                "items": {
                  "type": "integer",
                  "minimum": 0,
                  "maximum": 100
                },
                "minItems": 1
              },
              {
                "type": "object",
                "description": "Range definition for generating quality values",
                "required": ["start", "stop", "step"],
                "properties": {
                  "start": {
                    "type": "integer",
                    "minimum": 0,
                    "maximum": 100
                  },
                  "stop": {
                    "type": "integer",
                    "minimum": 0,
                    "maximum": 100
                  },
                  "step": {
                    "type": "integer",
                    "minimum": 1
                  }
                },
                "additionalProperties": false
              }
            ]
          },
          "chroma_subsampling": {
            "type": "array",
            "description": "Chroma subsampling modes to sweep. Only applicable to formats that support it (AVIF, JPEG XL). If omitted, encoder default is used.",
            "items": {
              "type": "string",
              "enum": ["444", "422", "420", "400"]
            },
            "minItems": 1
          },
          "speed": {
            "description": "AVIF encoder speed settings to sweep (0-10, where 0=slowest/best quality, 10=fastest). Only applicable to AVIF format.",
            "oneOf": [
              {
                "type": "integer",
                "minimum": 0,
                "maximum": 10
              },
              {
                "type": "array",
                "items": {
                  "type": "integer",
                  "minimum": 0,
                  "maximum": 10
                },
                "minItems": 1
              }
            ]
          },
          "effort": {
            "description": "JPEG XL encoder effort settings to sweep (1-10, where higher=slower/better quality). Only applicable to JPEG XL format.",
            "oneOf": [
              {
                "type": "integer",
                "minimum": 1,
                "maximum": 10
              },
              {
                "type": "array",
                "items": {
                  "type": "integer",
                  "minimum": 1,
                  "maximum": 10
                },
                "minItems": 1
              }
            ]
          },
          "method": {
            "description": "WebP compression method settings to sweep (0-6, where 0=fast, 6=slowest/best quality). Only applicable to WebP format.",
            "oneOf": [
              {
                "type": "integer",
                "minimum": 0,
                "maximum": 6
              },
              {
                "type": "array",
                "items": {
                  "type": "integer",
                  "minimum": 0,
                  "maximum": 6
                },
                "minItems": 1
              }
            ]
          },
          "resolution": {
            "description": "Target resolutions (longest edge in pixels) to sweep. Each value produces a downscaled copy of the source image before encoding. If omitted, the original resolution is used.",
            "oneOf": [
              {
                "type": "integer",
                "minimum": 1
              },
              {
                "type": "array",
                "items": {
                  "type": "integer",
                  "minimum": 1
                },
                "minItems": 1
              }
            ]
          },
          "extra_args": {
            "type": "object",
            "description": "Encoder-specific extra arguments as key-value pairs. Keys are CLI argument names (without leading dashes), values are argument values. These are passed directly to the encoder CLI tool.",
            "additionalProperties": {
              "type": ["string", "integer", "boolean"]
            }
          }
        },
        "additionalProperties": false
      }
    }
  },
  "additionalProperties": false
}
